[
  {
    "id": "CLI-01.001",
    "parent": "CLI-01",
    "capability_ids": [
      "option:search-skip-screen"
    ],
    "contract": "spec/behavior/01-startup-options.md",
    "clause": "OPTIONS: search-skip-screen",
    "case_ids": [
      "option-search-skip-screen-0",
      "option-search-skip-screen-1",
      "option-search-skip-screen-2",
      "option-search-skip-screen-3",
      "query-default-search-skip-screen"
    ],
    "evidence": "source-backed",
    "status": "specified",
    "related_parents": []
  },
  {
    "id": "CLI-01.002",
    "parent": "CLI-01",
    "capability_ids": [
      "option:buffers"
    ],
    "contract": "spec/behavior/01-startup-options.md",
    "clause": "OPTIONS: buffers",
    "case_ids": [
      "missing-value-option:buffers",
      "negative-option:buffers",
      "option-buffers-0",
      "option-buffers-1",
      "overflow-option:buffers",
      "query-default-buffers",
      "zero-option:buffers"
    ],
    "evidence": "source-backed",
    "status": "specified",
    "related_parents": []
  },
  {
    "id": "CLI-01.003",
    "parent": "CLI-01",
    "capability_ids": [
      "option:auto-buffers"
    ],
    "contract": "spec/behavior/01-startup-options.md",
    "clause": "OPTIONS: auto-buffers",
    "case_ids": [
      "option-auto-buffers-0",
      "option-auto-buffers-1",
      "query-default-auto-buffers"
    ],
    "evidence": "source-backed",
    "status": "specified",
    "related_parents": []
  },
  {
    "id": "CLI-01.004",
    "parent": "CLI-01",
    "capability_ids": [
      "option:clear-screen"
    ],
    "contract": "spec/behavior/01-startup-options.md",
    "clause": "OPTIONS: clear-screen",
    "case_ids": [
      "option-clear-screen-0",
      "option-clear-screen-1",
      "option-clear-screen-2",
      "option-clear-screen-3",
      "query-default-clear-screen"
    ],
    "evidence": "source-backed",
    "status": "specified",
    "related_parents": []
  },
  {
    "id": "CLI-01.005",
    "parent": "CLI-01",
    "capability_ids": [
      "option:dumb"
    ],
    "contract": "spec/behavior/01-startup-options.md",
    "clause": "OPTIONS: dumb",
    "case_ids": [
      "option-dumb-0",
      "option-dumb-1",
      "query-default-dumb"
    ],
    "evidence": "source-backed",
    "status": "specified",
    "related_parents": []
  },
  {
    "id": "CLI-01.006",
    "parent": "CLI-01",
    "capability_ids": [
      "option:color"
    ],
    "contract": "spec/behavior/01-startup-options.md",
    "clause": "OPTIONS: color",
    "case_ids": [
      "missing-value-option:color",
      "option-color-0",
      "option-color-1"
    ],
    "evidence": "source-backed",
    "status": "specified",
    "related_parents": [
      "DISPLAY-04"
    ]
  },
  {
    "id": "CLI-01.007",
    "parent": "CLI-01",
    "capability_ids": [
      "option:quit-at-eof"
    ],
    "contract": "spec/behavior/01-startup-options.md",
    "clause": "OPTIONS: quit-at-eof",
    "case_ids": [
      "onescreen--E-00",
      "onescreen--E-01",
      "onescreen--E-10",
      "onescreen--E-11",
      "option-quit-at-eof-0",
      "option-quit-at-eof-1",
      "option-quit-at-eof-2",
      "option-quit-at-eof-3",
      "query-default-quit-at-eof"
    ],
    "evidence": "source-backed",
    "status": "specified",
    "related_parents": []
  },
  {
    "id": "CLI-01.008",
    "parent": "CLI-01",
    "capability_ids": [
      "option:force"
    ],
    "contract": "spec/behavior/01-startup-options.md",
    "clause": "OPTIONS: force",
    "case_ids": [
      "option-force-0",
      "option-force-1",
      "query-default-force"
    ],
    "evidence": "source-backed",
    "status": "specified",
    "related_parents": []
  },
  {
    "id": "CLI-01.009",
    "parent": "CLI-01",
    "capability_ids": [
      "option:quit-if-one-screen"
    ],
    "contract": "spec/behavior/01-startup-options.md",
    "clause": "OPTIONS: quit-if-one-screen",
    "case_ids": [
      "onescreen--E-00",
      "onescreen--E-01",
      "onescreen--E-10",
      "onescreen--E-11",
      "onescreen--X-00",
      "onescreen--X-01",
      "onescreen--X-10",
      "onescreen--X-11",
      "option-quit-if-one-screen-0",
      "option-quit-if-one-screen-1",
      "query-default-quit-if-one-screen"
    ],
    "evidence": "source-backed",
    "status": "specified",
    "related_parents": []
  },
  {
    "id": "CLI-01.010",
    "parent": "CLI-01",
    "capability_ids": [
      "option:hilite-search"
    ],
    "contract": "spec/behavior/01-startup-options.md",
    "clause": "OPTIONS: hilite-search",
    "case_ids": [
      "option-hilite-search-0",
      "option-hilite-search-1",
      "option-hilite-search-2",
      "option-hilite-search-3",
      "query-default-hilite-search"
    ],
    "evidence": "source-backed",
    "status": "specified",
    "related_parents": []
  },
  {
    "id": "CLI-01.011",
    "parent": "CLI-01",
    "capability_ids": [
      "option:max-back-scroll"
    ],
    "contract": "spec/behavior/01-startup-options.md",
    "clause": "OPTIONS: max-back-scroll",
    "case_ids": [
      "missing-value-option:max-back-scroll",
      "negative-option:max-back-scroll",
      "option-max-back-scroll-0",
      "option-max-back-scroll-1",
      "overflow-option:max-back-scroll",
      "query-default-max-back-scroll",
      "zero-option:max-back-scroll"
    ],
    "evidence": "source-backed",
    "status": "specified",
    "related_parents": []
  },
  {
    "id": "CLI-01.012",
    "parent": "CLI-01",
    "capability_ids": [
      "option:ignore-case"
    ],
    "contract": "spec/behavior/01-startup-options.md",
    "clause": "OPTIONS: ignore-case",
    "case_ids": [
      "option-ignore-case-0",
      "option-ignore-case-1",
      "option-ignore-case-2",
      "option-ignore-case-3",
      "pair-search-chop-00",
      "pair-search-chop-01",
      "pair-search-chop-10",
      "pair-search-chop-11",
      "query-default-ignore-case"
    ],
    "evidence": "source-backed",
    "status": "specified",
    "related_parents": []
  },
  {
    "id": "CLI-01.013",
    "parent": "CLI-01",
    "capability_ids": [
      "option:jump-target"
    ],
    "contract": "spec/behavior/01-startup-options.md",
    "clause": "OPTIONS: jump-target",
    "case_ids": [
      "missing-value-option:jump-target",
      "option-jump-target-0",
      "option-jump-target-1",
      "query-default-jump-target"
    ],
    "evidence": "source-backed",
    "status": "specified",
    "related_parents": []
  },
  {
    "id": "CLI-01.014",
    "parent": "CLI-01",
    "capability_ids": [
      "option:status-column"
    ],
    "contract": "spec/behavior/01-startup-options.md",
    "clause": "OPTIONS: status-column",
    "case_ids": [
      "option-status-column-0",
      "option-status-column-1",
      "pair-quiet-status-00",
      "pair-quiet-status-01",
      "pair-quiet-status-10",
      "pair-quiet-status-11",
      "query-default-status-column"
    ],
    "evidence": "source-backed",
    "status": "specified",
    "related_parents": []
  },
  {
    "id": "CLI-01.015",
    "parent": "CLI-01",
    "capability_ids": [
      "option:lesskey-file"
    ],
    "contract": "spec/behavior/01-startup-options.md",
    "clause": "OPTIONS: lesskey-file",
    "case_ids": [
      "option-lesskey-file-0",
      "option-lesskey-file-1"
    ],
    "evidence": "source-backed",
    "status": "specified",
    "related_parents": [
      "LEGACY-01"
    ]
  },
  {
    "id": "CLI-01.016",
    "parent": "CLI-01",
    "capability_ids": [
      "option:lesskey-content"
    ],
    "contract": "spec/behavior/01-startup-options.md",
    "clause": "OPTIONS: lesskey-content",
    "case_ids": [
      "missing-value-option:lesskey-content",
      "option-lesskey-content-0"
    ],
    "evidence": "source-backed",
    "status": "specified",
    "related_parents": []
  },
  {
    "id": "CLI-01.017",
    "parent": "CLI-01",
    "capability_ids": [
      "option:lesskey-src"
    ],
    "contract": "spec/behavior/01-startup-options.md",
    "clause": "OPTIONS: lesskey-src",
    "case_ids": [
      "missing-value-option:lesskey-src",
      "option-lesskey-src-0"
    ],
    "evidence": "source-backed",
    "status": "specified",
    "related_parents": []
  },
  {
    "id": "CLI-01.018",
    "parent": "CLI-01",
    "capability_ids": [
      "option:quit-on-intr"
    ],
    "contract": "spec/behavior/01-startup-options.md",
    "clause": "OPTIONS: quit-on-intr",
    "case_ids": [
      "option-quit-on-intr-0",
      "option-quit-on-intr-1",
      "query-default-quit-on-intr"
    ],
    "evidence": "source-backed",
    "status": "specified",
    "related_parents": []
  },
  {
    "id": "CLI-01.019",
    "parent": "CLI-01",
    "capability_ids": [
      "option:no-lessopen"
    ],
    "contract": "spec/behavior/01-startup-options.md",
    "clause": "OPTIONS: no-lessopen",
    "case_ids": [
      "option-no-lessopen-0",
      "option-no-lessopen-1",
      "query-default-no-lessopen"
    ],
    "evidence": "source-backed",
    "status": "specified",
    "related_parents": []
  },
  {
    "id": "CLI-01.020",
    "parent": "CLI-01",
    "capability_ids": [
      "option:long-prompt"
    ],
    "contract": "spec/behavior/01-startup-options.md",
    "clause": "OPTIONS: long-prompt",
    "case_ids": [
      "option-long-prompt-0",
      "option-long-prompt-1",
      "option-long-prompt-2",
      "option-long-prompt-3",
      "query-default-long-prompt"
    ],
    "evidence": "source-backed",
    "status": "specified",
    "related_parents": []
  },
  {
    "id": "CLI-01.021",
    "parent": "CLI-01",
    "capability_ids": [
      "option:line-numbers"
    ],
    "contract": "spec/behavior/01-startup-options.md",
    "clause": "OPTIONS: line-numbers",
    "case_ids": [
      "option-line-numbers-0",
      "option-line-numbers-1",
      "option-line-numbers-2",
      "option-line-numbers-3",
      "pair-header-number-00",
      "pair-header-number-01",
      "pair-header-number-10",
      "pair-header-number-11",